{
    "name": "",
    "description": "",
    "category": "race_traits",
    "effects": [
        "_dnd5e:effects.abilities.str_add@1",
        "_dnd5e:effects.abilities.dex_add@1",
        "_dnd5e:effects.abilities.con_add@1",
        "_dnd5e:effects.abilities.int_add@1",
        "_dnd5e:effects.abilities.wis_add@1",
        "_dnd5e:effects.abilities.cha_add@1"
    ]
}