{"name": "%features.elf.high.weapons/name%", "description": "%features.elf.high.weapons/description%", "category": "subrace_proficiencies", "effects": ["_dnd5e:effects.proficiencies.weapons.longsword", "_dnd5e:effects.proficiencies.weapons.shortsword", "_dnd5e:effects.proficiencies.weapons.shortbow", "_dnd5e:effects.proficiencies.weapons.longbow"]}